{
  "schema_version": "1.0.0",
  "document_type": "TYMM_TEACHER_BOOK_ANSWER_BANK",
  "course_id": "TDE_11",
  "theme_id": "TEMA_03",
  "authority": "SOURCE_FILTERED_CANONICAL_ANSWERS",
  "policy": "Only answers with source provenance independent of retired teacher-guide content and not classified as PEDAGOGICAL_ENRICHMENT are retained. This is a factual answer bank, not a pedagogy template.",
  "counts": {
    "answers": 64,
    "excluded_legacy_or_pedagogical": 0,
    "excluded_without_answer": 1
  },
  "answers": [
    {
      "answer_id": "T03-A0001",
      "theme_id": "TEMA_03",
      "printed_page_range": "160",
      "label": "Tema kapsamı ve beklenen öğrenmeler",
      "item_type": "REFERENCE",
      "expected_answer": {
        "anlama": [
          "Huzur romanı",
          "Mehmet Akif Ersoy biyografisi",
          "Usûlî tezkiresi",
          "Direnişin Ustaları radyo tiyatrosu"
        ],
        "anlatma": [
          "Huzur kişisiyle hayalî mülakat",
          "radyo tiyatrosu diyaloğunu başka türe dönüştürme"
        ],
        "odak": [
          "edebiyat-hayat ilişkisi",
          "gerçeklik-kurmaca",
          "yazar-eser ilişkisi",
          "kişisel hayatı konu alan metinler"
        ]
      },
      "acceptance_criteria": [],
      "source_ids": [
        "official_textbook_pdf"
      ],
      "source_locators": [
        "basılı s.160 / PDF s.161"
      ],
      "verification_status": "VERIFIED"
    },
    {
      "answer_id": "T03-A0002",
      "theme_id": "TEMA_03",
      "printed_page_range": "162",
      "label": "Temaya Başlarken — görselden yaşam ve roman çağrışımları",
      "item_type": "QUESTION",
      "expected_answer": {
        "1": "Yoldaki kişi; yaşam yolculuğu, arayış, değişim, hedefe ilerleme veya belirsizlik gibi anlamlarla gerekçeli biçimde yorumlanabilir.",
        "2": "Öğrencinin kendi yaşantısıyla kurduğu çağrışım gerekçeli ve görsel bir ayrıntıya dayalıysa kabul edilir.",
        "3": "Görselden yalnız kesin olay bilgisi değil; yalnızlık, yolculuk, mücadele, umut, geçicilik gibi olası yaşam durumları çıkarılabilir.",
        "4": "Roman adı serbesttir; görseldeki yol/kişi/atmosferle gerekçeli bağ kurulmalıdır."
      },
      "acceptance_criteria": [
        "Her yorum görseldeki en az bir unsura dayanır.",
        "Kesin olmayan çıkarımları olasılık diliyle ifade eder."
      ],
      "source_ids": [
        "official_textbook_pdf"
      ],
      "source_locators": [
        "basılı s.162 / PDF s.163"
      ],
      "verification_status": "VERIFIED"
    },
    {
      "answer_id": "T03-A0003",
      "theme_id": "TEMA_03",
      "printed_page_range": "163",
      "label": "Görsellerin çağrışımı",
      "item_type": "QUESTION",
      "expected_answer": "Görseller, kişinin yaşam öyküsü, sanatçı kimliği, dönem, mekân, eser ve biyografik izler hakkında çağrışım oluşturabilir; somut görsel kanıtla gerekçelendirilen farklı cevaplar kabul edilir.",
      "acceptance_criteria": [
        "En az bir görsel ayrıntıyı yorumla ilişkilendirir."
      ],
      "source_ids": [
        "official_textbook_pdf"
      ],
      "source_locators": [
        "basılı s.163 / PDF s.164"
      ],
      "verification_status": "VERIFIED"
    },
    {
      "answer_id": "T03-A0004",
      "theme_id": "TEMA_03",
      "printed_page_range": "163",
      "label": "Biyografi ve tezkire ön örneklerini karşılaştırma",
      "item_type": "QUESTION",
      "expected_answer": {
        "ortak": "Her ikisi de gerçek kişiyi, yaşamı/sanat kişiliğini ve belirgin özellikleri tanıtır.",
        "fark": "Modern biyografi daha açık, belgeleyici ve sistematik anlatıma; tezkire ise döneminin dili, övgü/değerlendirme kalıpları ve şairlik örneklerine yaslanır."
      },
      "acceptance_criteria": [
        "Gerçek kişiyi tanıtma ortaklığını belirtir.",
        "Dil/dönem/anlatım farklarından en az birini açıklar."
      ],
      "source_ids": [
        "official_textbook_pdf"
      ],
      "source_locators": [
        "basılı s.163 / PDF s.164"
      ],
      "verification_status": "VERIFIED"
    },
    {
      "answer_id": "T03-A0005",
      "theme_id": "TEMA_03",
      "printed_page_range": "164",
      "label": "Konuya Başlarken — yazar, hayat ve roman",
      "item_type": "QUESTION",
      "expected_answer": {
        "1": "Yazar yaşantı, gözlem ve kültürel birikiminden beslenebilir; bunları seçer, dönüştürür ve kurmaca yapıda yeniden düzenler.",
        "2": "“Hayatımı yazsam roman olurdu” sözü yaşanmışlıkların anlatı malzemesi olabileceğini vurgular; hayat ile roman aynı şey değildir.",
        "3": "Kişisel deneyim ayrıntıları metne inandırıcılık ve psikolojik derinlik katabilir; tek başına doğruluk garantisi değildir."
      },
      "acceptance_criteria": [
        "Hayatın kurmacaya kaynak olabileceğini söyler.",
        "Kurmacanın dönüştürücü niteliğini korur."
      ],
      "source_ids": [
        "official_textbook_pdf"
      ],
      "source_locators": [
        "basılı s.164 / PDF s.165"
      ],
      "verification_status": "VERIFIED"
    },
    {
      "answer_id": "T03-A0006",
      "theme_id": "TEMA_03",
      "printed_page_range": "165",
      "label": "Huzur’u okuma amacı, tahmin ve yazar araştırması",
      "item_type": "PROCESS",
      "expected_answer": [
        "Metne göz gezdir ve başlık/görsellerden içerik tahmini yap.",
        "Okuma amacını ve stratejini belirle.",
        "Tanpınar’ın hayatı, sanat anlayışı, dil/üslubu hakkında güvenilir kaynaklardan kısa not çıkar.",
        "Okuma sonunda ilk tahminlerini metinle karşılaştır."
      ],
      "acceptance_criteria": [
        "Tahmin ile doğrulanmış bulguyu ayırır.",
        "Yazar-eser ilişkisini tek yönlü özdeşlik olarak kurmaz."
      ],
      "source_ids": [
        "official_textbook_pdf"
      ],
      "source_locators": [
        "basılı s.165 / PDF s.166"
      ],
      "verification_status": "VERIFIED"
    },
    {
      "answer_id": "T03-A0007",
      "theme_id": "TEMA_03",
      "printed_page_range": "166",
      "label": "Kelime–yaşam çağrışımı ve okuma stratejisi",
      "item_type": "PROCESS",
      "expected_answer": "Öğrenci verilen kelimeleri farklı bağlamlarda cümleleştirir; çağrışımların kişisel deneyimle değişebileceğini fark eder ve Huzur için uygun okuma stratejisi seçer.",
      "acceptance_criteria": [
        "Bağlama göre anlam/çağrışım değişimini fark eder."
      ],
      "source_ids": [
        "official_textbook_pdf"
      ],
      "source_locators": [
        "basılı s.166 / PDF s.167"
      ],
      "verification_status": "VERIFIED"
    },
    {
      "answer_id": "T03-A0008",
      "theme_id": "TEMA_03",
      "printed_page_range": "167-170",
      "label": "Huzur ana metin okuması",
      "item_type": "REFERENCE",
      "expected_answer": [
        "Mümtaz–Nuran ilişkisi",
        "İstanbul/Boğaz’ın kültürel bellek taşıması",
        "müzik ve estetik duyarlık",
        "geçmiş–gelecek ve kimlik gerilimi",
        "toplumsal hayat ile bireysel duyarlığın birlikte verilmesi"
      ],
      "acceptance_criteria": [],
      "source_ids": [
        "official_textbook_pdf"
      ],
      "source_locators": [
        "basılı s.167-170"
      ],
      "verification_status": "VERIFIED"
    },
    {
      "answer_id": "T03-A0009",
      "theme_id": "TEMA_03",
      "printed_page_range": "172",
      "label": "Söz Varlığımız",
      "item_type": "VOCABULARY",
      "expected_answer": {
        "cevher": "öz/değerli nitelik",
        "zarafet": "incelik, estetik nezaket",
        "hülasa": "özetle",
        "mahzen": "yer altı depo/bodrum",
        "yeis": "umutsuzluk",
        "neşretmek": "yayımlamak/yaymak",
        "muazzam": "çok büyük, görkemli",
        "mustarip": "acı/sıkıntı çeken"
      },
      "acceptance_criteria": [
        "Önce bağlamdan tahmin, sonra sözlük doğrulaması yapar."
      ],
      "source_ids": [
        "official_textbook_pdf"
      ],
      "source_locators": [
        "basılı s.172 / PDF s.173"
      ],
      "verification_status": "VERIFIED"
    },
    {
      "answer_id": "T03-A0010",
      "theme_id": "TEMA_03",
      "printed_page_range": "174",
      "label": "Huzur’un üslup özellikleri kavram haritası",
      "item_type": "TABLE",
      "expected_answer": [
        "betimleyici ve çağrışımlı anlatım",
        "kültür, tarih ve musiki göndermeleri",
        "psikolojik çözümleme/iç dünya",
        "uzun ve katmanlı cümle yapıları",
        "mekânı estetik/kültürel anlam taşıyıcısı olarak kullanma"
      ],
      "acceptance_criteria": [
        "En az üç özellik metin örneği/işleviyle ilişkilendirilir."
      ],
      "source_ids": [
        "official_textbook_pdf"
      ],
      "source_locators": [
        "basılı s.174 / PDF s.175"
      ],
      "verification_status": "VERIFIED"
    },
    {
      "answer_id": "T03-A0011",
      "theme_id": "TEMA_03",
      "printed_page_range": "175-176",
      "label": "Metni Anlayalım — Huzur",
      "item_type": "QUESTION",
      "expected_answer": {
        "1": "Başlangıç tahminleri metin kanıtıyla karşılaştırılır.",
        "2": "Konu: Mümtaz’ın çevresi, Nuran’la ilişkisi ve İstanbul üzerinden hayat/kültür; tema: kimlik, geçmiş-gelecek, aşk, kültürel süreklilik ve huzur arayışı. Yazılma amacı yalnız bilgi vermek değil, insan ve toplum deneyimini estetik kurmaca ile düşündürmektir.",
        "3": "Psikolojik/tahlil ve sosyal-kültürel yönleri güçlü modern roman olarak gerekçelendirilebilir; sınıflandırma gerekçesi metin özelliklerine dayanmalıdır.",
        "4": "Boğaz/İstanbul yalnız fon değil; karakterlerin hafızası, kimliği ve estetik duyarlığıyla ilişkilidir.",
        "5": "Geçmişe kök salarak geleceğe yönelme düşüncesini ifade eder.",
        "6": "‘Kendi hayatımızın kaynakları’ tarih, kültür, sanat, dil, musikî ve ortak hafıza gibi beslenme kaynaklarına işaret eder.",
        "7": "Şehir hayatı, halk, yoksulluk, semtler, gündelik yaşam, kültürel kurumlar ve dönemin toplumsal meseleleri örneklenebilir.",